,uri,track,duration_ms,explicit,track_number,artist,album,danceability,energy,key,loudness,speechiness,acousticness,instrumentalness,liveness,valence,tempo,popularity,lyrics
84,spotify:track:4CHpVfAhuxNJ3ibExe6kxO,You All Over Me taylors Version From The Vault,220839,False,21,Taylor Swift,Fearless (Taylor's Version),0.599,0.494,2,-7.61,0.0372,0.816,0.0,0.10099999999999999,0.44,142.893,64,"Once the last drop of rain has dried off the pavement Shouldn't I find a stain, but I never do The way the tires turn stones on old county roads They leave 'em muddy underneath, reminds me of you You find graffiti on the walls of old bathroom stalls You know, you can scratch it right off, it's how it used to be But like the dollar in your pocket, it's been spent and traded in You can't change where it's been, reminds me of me I lived, and I learned, had you, got burned Held out, and held on God knows, too long, and wasted time Lost tears, swore that I'd get out of here But no amount of freedom gets you clean I've still got you all over me The best and worst day of June Was the one that I met you With your hands in your pockets And your ""Don't you wish you had me?"" grin Well I did, so I smiled And I melted like a child Now every breath of air I breathe reminds me of then And I lived, and I learned, had you, got burned Held out, and held on God knows, too long, and wasted time Lost tears, swore that I'd get out of here But no amount of freedom gets you clean I've still got you all over me I lived, and I learned And found out what it was to turn around And see that we Were never really meant to be So I lied, and I cried And I watched a part of myself die 'Cause no amount of freedom gets you clean I've still got you all over me I've still got you all over me Still got you all over me"
85,spotify:track:2CYVETnhM9aytqrazYYwrK,Mr Perfectly Fine Taylors Version From The Vault,277591,False,22,Taylor Swift,Fearless (Taylor's Version),0.66,0.8170000000000001,11,-6.269,0.0521,0.162,0.0,0.0667,0.7140000000000001,135.942,74,"Mr. ""Perfect face"" Mr. ""Here to stay"" Mr. ""Looked me in the eye and told me you would never go away"" Everything was right Mr. ""I've been waitin' for you all my life"" Mr. ""Every single day until the end, I will be by your side"" But that was when I got to know Mr. ""Change of heart"" Mr. ""Leaves me all alone,"" I fall apart It takes everything in me just to get up each day But it's wonderful to see that you're okay Hello, Mr. ""Perfectly fine"" How's your heart after breakin' mine? Mr. ""Always at the right place at the right time,"" baby Hello, Mr. ""Casually cruel"" Mr. ""Everything revolves around you"" I've been Miss Misery since your goodbye And you're Mr. ""Perfectly fine"" Mr. ""Never told me why"" Mr. ""Never had to see me cry"" Mr. ""Insincere apology so he doesn't look like the bad guy"" He goes about his day Forgets he ever even heard my name Well, I thought you might be different than the rest, I guess you're all the same 'Cause I hear he's got his arm 'round a brand-new girl I've been pickin' up my heart, he's been pickin' up her And I never got past what you put me through But it's wonderful to see that it never phased you Hello, Mr. ""Perfectly fine"" How's your heart after breakin' mine? Mr. ""Always at the right place at the right time,"" baby Hello, Mr. ""Casually cruel"" Mr. ""Everything revolves around you"" I've been Miss Misery since your goodbye And you're Mr. ""Perfectly fine"" So dignified in your well-pressed suit So strategized, all the eyes on you Sashay your way to your seat It's the best seat, in the best room Oh, he's so smug, Mr. ""Always wins"" So far above me in every sense So far above feeling anything And it's really such a shame It's such a shame 'Cause I was Miss ""Here to stay"" Now I'm Miss ""Gonna be alright someday"" And someday maybe you'll miss me But by then, you'll be Mr. ""Too late"" Goodbye, Mr. ""Perfectly fine"" How's your heart after breakin' mine? Mr. ""Always at the right place at the right time,"" baby Goodbye, Mr. ""Casually cruel"" Mr. ""Everything revolves around you"" I've been Miss Misery for the last time And you're Mr. ""Perfectly fine"" You're perfectly fine Mr. ""Looked me in the eye and told me you would never go away"" You said you'd never go away"
86,spotify:track:34V9RiEPe8MNdU32qJsJa1,We Were Happy (Taylors Version) (From The Vault),244236,False,23,Taylor Swift,Fearless (Taylor's Version),0.609,0.373,0,-8.818999999999999,0.0263,0.8490000000000001,0.0,0.0779,0.13,106.007,66,"We used to walk along the streets When the porch lights were shining bright Before I had somewhere to be Back when we had all night and we were happy I do recall a good while back, we snuck into the circus You threw your arms around my neck, back when I deserved it And we were happy When it was good, baby, it was good, baby We showed 'em all up No one could touch the way we laughed in the dark Talking 'bout your daddy's farm we were gonna buy someday And we were happy We used to watch the sun go down on the boats in the water That's sorta how I feel right now And goodbye's so much harder 'cause we were happy When it was good, baby, it was good, baby We showed 'em all up No one could touch the way we laughed in the dark Talking 'bout your daddy's farm we were gonna buy someday And we were happy We were happy Oh, I hate those voices telling me I'm not in love anymore But they don't give me choices and that's what these tears are for 'Cause we were happy We were happy When it was good, baby, it was good, baby We showed 'em all up No one could touch the way we laughed in the dark Talking 'bout your daddy's farm And you were gonna marry me And we were happy We were happy Oh-oh-oh-oh We were happy"
87,spotify:track:7eResoqEJJAVTkQYSqvO3P,Thats When Taylors Version From The Vault,189495,False,24,Taylor Swift,Fearless (Taylor's Version),0.588,0.608,5,-7.062,0.0365,0.225,0.0,0.092,0.508,90.20100000000001,68,"You said, ""I know"" When I said, ""I need some time, need some space To think about all of this"" You watched me go And I knew my Words were hard to hear And harder to ever take back And I said, ""When can I-I-I come back?"" And you said that's when When I wake up in the morning That's when, when it's sunny or storming Laughing, when I'm crying And that's when, I'll be waiting at the front gate That's when, when I see your face I'll let you in, and baby, that's when Mm, mm I said, ""I know"" When you said, ""I did you wrong Made mistakes And put you through all of this"" (through all of this) Then through the phone Came all your tears And I said, ""Leave those all in our past"" And you said, ""When can I-I-I come back?"" And I said, that's when When I wake up in the morning That's when, when it's sunny or storming Laughing, when I'm crying And that's when I'll be waiting at the front gate That's when, when I see your face I'll let you in, and baby, that's when"" And you said, ""Honestly When you were gone Did you ever think of me?"" And I said ""That's when, when I woke up in the morning That's when, it was sunny or storming Laughing when I was crying And that's when, you were waiting at the front gate That's when, when I saw your face You let me in, and baby, that's when"" That's when, when I wake up in the morning (Yeah) That's when, when it's sunny or storming When I'm laughing, when I'm crying That's when I'll be waiting at the front gate (That when I miss you, that's when I want you) That's when, when I see your face That's when I love you, that's when"
88,spotify:track:4uuEGH5SVuzkkSFjo2DEiY,Dont You (Taylors Version) (From The Vault),208608,False,25,Taylor Swift,Fearless (Taylor's Version),0.563,0.473,3,-11.548,0.0503,0.514,1.2e-05,0.109,0.405,101.934,67,"Hey, I knew I'd run into you somewhere It's been a while, I didn't mean to stare I heard she's nothin' like me I'm sure she'll make you happy But don't you, don't you Smile at me and ask me how I've been Don't you say you've Missed me if you don't want me again You don't know how much I feel I love you still So why don't you, don't you? Ah, ah, ah, ah Ah, ah, ah Sometimes, I really wish that I could hate you I've tried, but that's just somethin' I can't do My heart knows what the truth is I swore I wouldn't do this But don't you, don't you Smile at me and ask me how I've been Don't you say you've Missed me if you don't want me again You don't know how much I feel I love you still So why don't you, don't you? So I walk outta here tonight Try to go on with my life And you can say we're still friends (But I don't wanna pretend) So if I see you again Don't you (Don't you), don't you Smile at me and ask me how I've been Don't you (Don't you) say you've Missed me if you don't want me again You don't (You don't) know how much I feel I love you still So why don't you, don't you? Ah, ah, ah, ah Don't you (Ah, ah, ah)"
89,spotify:track:4qUijfYU8EoIWiY6oSyrgT,Bye Bye Baby (Taylors Version) (From The Vault),242157,False,26,Taylor Swift,Fearless (Taylor's Version),0.624,0.624,5,-7.86,0.0539,0.33399999999999996,0.0,0.0995,0.527,80.132,65,"It wasn't just like a movie The rain didn't soak through my clothes, down to my skin I'm drivin' away and I, I guess you could say This is the last time I'll drive this way again Lost in the gray and I try to grab at the fray 'Cause I, I still love you but I can't Bye bye to everything I thought was on my side Bye bye baby I want you bad but it's come down to nothing And all I have is your sympathy 'Cause you took me home but you just couldn't keep me Bye bye baby Bye bye baby The picture frame is empty On the dresser, vacant just like me I see your writing on the dash Then back to your hesitation I was so sure of everything Everything I thought we'd always have Guess I never doubted it Then the here and the now floods in Feels like I'm becoming a part of your past Bye bye to everything I thought was on my side Bye bye baby I want you bad but it's come down to nothing And all I have is your sympathy 'Cause you took me home but you just couldn't keep me Bye bye baby And there's so much that I can't touch You're all I want but it's not enough this time And all the pages are just slipping through my hands And I'm so scared of how this ends Bye bye to everything I thought was on my side Bye bye baby I want you bad but it's come down to nothing And all I have is your sympathy 'Cause you took me home but you just couldn't keep me Bye bye to everything I thought was on my side Bye bye baby I want you bad but it's come down to nothing And all I have is your sympathy 'Cause you took me home but you just couldn't keep me Oh, you took me home, I thought you were gonna keep me Bye bye baby Bye bye baby"
90,spotify:track:08gavXombT6KR0af88i9tA,Jump Then Fall,237066,False,1,Taylor Swift,Fearless Platinum Edition,0.618,0.687,2,-5.737,0.0271,0.111,0.0,0.0693,0.82,79.991,47,"I like the way you sound in the morning We're on the phone and without a warning I realize your laugh is the best sound I have ever heard I like the way I can't keep my focus I watch you talk, you didn't notice I hear the words but all I can think is We should be together Every time you smile, I smile And every time you shine, I'll shine for you Whoa oh, I'm feeling you, baby Don't be afraid to Jump then fall Jump then fall into me Baby, I'm never gonna leave you Say that you wanna be with me too 'Cause I'ma stay through it all So jump then fall Well I like the way your hair falls in your face You got the keys to me I love each freckle on your face, oh I've never been so wrapped up, honey I like the way you're everything I ever wanted I had time to think it o-over And all I can say is come closer Take a deep breath and  jump then fall into me 'Cause every time you smile, I smile And every time you shine, I'll shine for you Whoa oh, I'm feeling you, baby Don't be afraid to Jump then fall Jump then fall into me Baby, I'm never gonna leave you Say that you wanna be with me too 'Cause I'ma stay through it all So jump then fall The bottom's gonna drop out from under our feet I'll catch you, I'll catch you When people say things that bring you to your knees I'll catch you The time is gonna come when you're so mad you could cry But I'll hold you through the night until you smile Whoa oh, I need you, baby Don't be afraid, please Jump then fall Jump then fall into me Baby, I'm never gonna leave you Say that you wanna be with me too 'Cause I'ma stay through it all So jump then fall Jump then fall, baby Jump then fall into me, into me Every time you smile, I smile And every time you shine, I shine And every time you're here Baby, I'll show you, I'll show you You can jump then fall, jump then fall Jump then fall into me, into me, yeah"
91,spotify:track:2IZ00ed83ygPIiacYScWUE,Untouchable,311040,False,2,Taylor Swift,Fearless Platinum Edition,0.419,0.45399999999999996,5,-6.809,0.0335,0.0583,3.78e-06,0.0974,0.28800000000000003,200.017,47,"Untouchable like a distant diamond sky I'm reaching out and I just can't tell you why I'm caught up in you, I'm caught up in you Untouchable, burning brighter than the sun And when you're close, I feel like coming undone In the middle of the night when I'm in this dream It's like a million little stars spelling out your name You got to come on, come on, say that we'll be together Come on, come on, little taste of heaven It's half full and I won't wait here all day I know you're saying that you'd be here anyway But you're untouchable, burning brighter than the sun Now that you're close, I feel like coming undone In the middle of the night when I'm in this dream It's like a million little stars spelling out your name You got to come on, come on, say that we'll be together Come on, come on, oh In the middle of the night waking from this dream I want to feel you by my side, standing next to me You got to come on, come on, say that we'll be together Come on, come on, little taste of heaven I'm caught up in you Oh-oh, oh, oh-oh But you're untouchable, burning brighter than the sun Now that you're close, I feel like coming undone In the middle of the night when I'm in this dream It's like a million little stars spelling out your name You got to come on, come on, say that we'll be together Come on, come on, oh In the middle of the night when I'm in this dream It's like a million little stars spelling out your name You got to come on, come on, say that we'll be together Come on, come on, come on In the middle of the night waking from this dream I want to feel you by my side, standing next to me You got to come on, come on, say that we'll be together Come on, come on, little taste of heaven And in the middle of the night when I'm in this dream It's like a million little stars spelling out your name You got to come on, come on, come on, come on Come on, come on, oh, oh, oh Like a million little stars spelling out your name They're spelling out your name, oh"
92,spotify:track:46HGgtwmmuEB8mvDCyjyAc,Forever and Always Piano Version,267506,False,3,Taylor Swift,Fearless Platinum Edition,0.5920000000000001,0.16,9,-10.785,0.0347,0.852,0.0,0.11599999999999999,0.294,118.929,48,"Once upon a time I believe it was a Tuesday when I caught your eye We caught onto something I hold onto the night You looked me in the eye and told me you loved me Were you just kidding? 'Cause it seems to me This thing is breaking down, we almost never speak I don't feel welcome anymore Baby, what happened? Please tell me 'Cause one second it was perfect Now you're halfway out the door And I stare at the phone, he still hasn't called And then you feel so low you can't feel nothing at all And you flashback to when he said ""forever and always"" Oh, and it rains in your bedroom, everything is wrong It rains when you're here and it rains when you're gone I was there when you said ""forever and always"" Was I out of line? Did I say something way too honest made you run and hide? Like a scared little boy I looked into your eyes Thought I knew you for a minute now I'm not so sure So here's to everything coming down to nothing Here's to silence that cuts me to the core Where is this going? Thought I knew for a minute but I don't anymore And I stare at the phone, he still hasn't called And then you feel so low you can't feel nothing at all And you flashback to when he said ""forever and always"" And it rains in your bedroom, everything is wrong It rains when you're here and it rains when you're gone I was there when you said ""forever and always"" You didn't mean it, baby I don't think so Oh, oh-oh, oh-oh-oh Oh-oh, oh-oh-oh, oh Back up, baby, back up Did you forget everything? Back up, baby, back up Did you forget everything? Back up, baby, back up Please back up, oh back up Back up, baby, back up 'Cause it rains in your bedroom, everything is wrong It rains when you're here and it rains when you're gone I was there when you said ""forever and always"" And I stare at the phone, he still hasn't called And then you feel so low you can't feel nothing at all And you flashback to when we said ""forever and always"" 'Cause it rains in your bedroom, everything is wrong It rains when you're here and it rains when you're gone I was there when you said ""forever and always"" You didn't mean it baby You said ""forever and always"", yeah"
93,spotify:track:4pl5zcqCv4vc3cB7M4MZ6f,Come In With The Rain,238106,False,4,Taylor Swift,Fearless Platinum Edition,0.527,0.475,2,-6.205,0.0258,0.0868,4.34e-06,0.248,0.22399999999999998,143.96200000000002,46,"I could go back to every laugh But I don't wanna go there anymore And I know all the steps up to your door But I don't wanna go there anymore Talk to the wind, talk to the sky Talk to the man with the reasons why And let me know what you find I'll leave my window open 'Cause I'm too tired at night to call your name Just know I'm right here hoping That you'll come in with the rain I could stand up and sing you a song But I don't wanna have to go that far And I, I've got you down, I know you by heart And you don't even know where I start Talk to yourself, talk to the tears Talk to the man who put you here And don't wait for the sky to clear I'll leave my window open 'Cause I'm too tired at night to call your name Just know I'm right here hoping That you'll come in with the rain I've watched you so long, screamed your name I don't know what else I can say But I'll leave my window open 'Cause I'm too tired at night for all these games Just know I'm right here hoping That you'll come in with the rain I could go back to every laugh But I don't wanna go there anymore"
94,spotify:track:14Bljc3pOOG0xQX3wqhLN9,SuperStar,261453,False,5,Taylor Swift,Fearless Platinum Edition,0.61,0.531,2,-6.122999999999999,0.0239,0.36700000000000005,0.0,0.35100000000000003,0.228,85.979,44,"This is wrong but I can't help but feel like There aint nothing more right babe Misty morning comes again and I can't Help but wish I could see your face And I knew from the first note played I'd be breaking all my rules to see you You smile that beautiful smile and all the girls in the front row Scream your name So dim that spotlight, tell me things like I can't take my eyes off of you I'm no one special, just another wide-eyed girl Who's desperately in love with you Give me a photograph to hang on my wall, superstar Good morning loneliness Comes around when I'm not dreaming about you When my world wakes up today You'll be in another town And I knew when I saw your face I'd be counting down the ways to see you You smile that beautiful smile and all the girls in the front row Scream your name So dim that spotlight, tell me things like I can't take my eyes off of you I'm no one special, just another wide-eyed girl Who's desperately in love with you Give me a photograph to hang on my wall, superstar You played in bars, you play guitar And I'm invisible and everyone knows who you are And you'll never see, you sing me to sleep Every night from the radio So dim that spotlight, tell me things like I can't take my eyes off of you I'm no one special, just another wide-eyed girl Who's desperately in love with you Give me a photograph to hang on my wall, superstar Sweet, sweet superstar Superstar"
95,spotify:track:0xvsgzM8AtBtRHZm5rav8A,The Other Side Of The Door,237600,False,6,Taylor Swift,Fearless Platinum Edition,0.47600000000000003,0.816,4,-4.279,0.0347,0.16899999999999998,0.0,0.23800000000000002,0.469,163.847,45,"In the heat of the fight I walked away Ignoring words that you were saying Trying to make me stay I said, ""This time I've had enough"" And you've called a hundred times But I'm not picking up 'Cause I'm so mad I might tell you that it's over But if you look a little closer I said, ""Leave,"" but all I really want is you To stand outside my window throwing pebbles Screaming, ""I'm in love with you"" Wait there in the pouring rain Come back for more And don't you leave 'cause I know All I need is on the other side of the door Me and my stupid pride are sitting here alone Going through the photographs, staring at the phone I keep going back over things we both said And I remember the slamming door And all the things that I misread So babe if you know everything Tell me why you couldn't see When I left, I wanted you to chase after me Yeah, I said, ""Leave,"" but all I really want is you To stand outside my window throwing pebbles Screaming, ""I'm in love with you"" Wait there in the pouring rain Come back for more And don't you leave 'cause I know All I need is on the other side of the door And I'll scream out the window I can't even look at you I don't need you but I do, I do, I do I say, ""There's nothing you can say To make this right again, I mean it, I mean it"" What I mean is I said, ""Leave,"" but baby, all I want is you To stand outside my window throwing pebbles Screaming, ""I'm in love with you"" Wait there in the pouring rain Come back for more And don't you leave 'cause I know All I need is on the other side of the door With your face and the beautiful eyes And the conversation with the little white lies And the faded picture of a beautiful night You carried me from your car up the stairs And I broke down crying, was she worth this mess? After everything and that little black dress After everything I must confess, I need you"
96,spotify:track:3F6czr26ZwGU5O5CHY04Ma,Fearless,242000,False,7,Taylor Swift,Fearless Platinum Edition,0.598,0.7140000000000001,5,-4.397,0.0273,0.0364,1.04e-06,0.31,0.467,99.979,49,"There's something 'bout the way The street looks when it's just rained There's a glow off the pavement, you walk me to the car And you know I wanna ask you to dance right there In the middle of the parking lot, yeah Oh, yeah We're driving down the road, I wonder if you know I'm trying so hard not to get caught up now But you're just so cool, run your hands through your hair Absentmindedly making me want you And I don't know how it gets better than this You take my hand and drag me head first, fearless And I don't know why but with you I'd dance In a storm in my best dress, fearless So, baby, drive slow 'til we run out of road In this one horse town, I wanna stay right here In this passenger's seat You put your eyes on me In this moment now, capture it, remember it 'Cause I don't know how it gets better than this You take my hand and drag me head first, fearless And I don't know why but with you I'd dance In a storm in my best dress, fearless Well, you stood there with me in the doorway My hands shake, I'm not usually this way but You pull me in and I'm a little more brave It's the first kiss, it's flawless, really something It's fearless Oh, yeah 'Cause I don't know how it gets better than this You take my hand and drag me head first, fearless And I don't know why but with you I'd dance In a storm in my best dress, fearless 'Cause I don't know how it gets better than this You take my hand and drag me head first, fearless And I don't know why but with you I'd dance In a storm in my best dress, fearless Oh, oh Oh, yeah"
