,uri,track,duration_ms,explicit,track_number,artist,album,danceability,energy,key,loudness,speechiness,acousticness,instrumentalness,liveness,valence,tempo,popularity,lyrics
177,spotify:track:1q3RiD1tIWUpGsNFADMlvl,All Too Well,327893,False,5,Taylor Swift,Red (Deluxe Edition),0.602,0.609,0,-7.803,0.0243,0.0382,0.0002,0.127,0.337,93.06,75,"I walked through the door with you, the air was cold But something 'bout it felt like home somehow And I left my scarf there at your sister's house And you've still got it in your drawer, even now Oh, your sweet disposition and my wide-eyed gaze We're singing in the car, getting lost upstate Autumn leaves falling down like pieces into place And I can picture it after all these days And I know it's long gone and That magic's not here no more And I might be okay, but I'm not fine at all Oh, oh, oh 'Cause there we are again on that little town street You almost ran the red 'cause you were lookin' over at me Wind in my hair, I was there I remember it all too well Photo album on the counter, your cheeks were turning red You used to be a little kid with glasses in a twin-sized bed And your mother's telling stories 'bout you on the tee-ball team You taught me 'bout your past, thinking your future was me And I know it's long gone and There was nothing else I could do And I forget about you long enough To forget why I needed to 'Cause there we are again in the middle of the night We're dancing round the kitchen in the refrigerator light Down the stairs, I was there I remember it all too well, yeah Well maybe we got lost in translation Maybe I asked for too much But maybe this thing was a masterpiece 'Til you tore it all up Running scared, I was there I remember it all too well And you call me up again Just to break me like a promise So casually cruel in the name of being honest I'm a crumpled up piece of paper lying here 'Cause I remember it all, all, all Too well Time won't fly, it's like I'm paralyzed by it I'd like to be my old self again, but I'm still trying to find it After plaid shirt days and nights when you made me your own Now you mail back my things and I walk home alone But you keep my old scarf from that very first week 'Cause it reminds you of innocence and it smells like me You can't get rid of it 'Cause you remember it all too well, yeah 'Cause there we are again when I loved you so Back before you lost the one real thing you've ever known It was rare, I was there I remember it all too well Wind in my hair, you were there You remember it all Down the stairs, you were there You remember it all It was rare, I was there I remember it all too well"
178,spotify:track:3bIxTsfeNMO7Nt2J3EUKrA,22,230133,False,6,Taylor Swift,Red (Deluxe Edition),0.6579999999999999,0.7290000000000001,7,-6.561,0.0378,0.00215,0.0013,0.0752,0.6679999999999999,104.007,65,"It feels like a perfect night To dress up like hipsters And make fun of our exes, uh-uh, uh-uh It feels like a perfect night For breakfast at midnight To fall in love with strangers, uh-uh, uh-uh Yeah We're happy, free, confused, and lonely at the same time It's miserable and magical, oh, yeah Tonight's the night when we forget about the deadlines It's time, oh-oh I don't know about you, but I'm feeling 22 Everything will be alright if you keep me next to you You don't know about me, but I'll bet you want to Everything will be alright if we just keep dancing like we're 22, 22 It seems like one of those nights This place is too crowded Too many cool kids, uh-uh, uh-uh (Who's Taylor Swift, anyway? Ew) It seems like one of those nights We ditch the whole scene And end up dreaming Instead of sleeping Yeah We're happy, free, confused, and lonely in the best way It's miserable and magical, oh, yeah Tonight's the night when we forget about the heartbreaks It's time, oh-oh (Hey!) I don't know about you, but I'm feeling 22 Everything will be alright (Ooh) if you keep me next to you You don't know about me, but I'll bet you want to Everything will be alright if (Alright) We just keep dancing like we're 22 (Oh, oh, oh, oh, oh) 22 (I don't know about you) 22, 22 It feels like one of those nights We ditch the whole scene It feels like one of those nights We won't be sleeping It feels like one of those nights You look like bad news I gotta have you I gotta have you Ooh, ooh, yeah (Hey!) I don't know about you, but I'm feeling 22 Everything will be alright if (Ooh) you keep me next to you You don't know about me, but I'll bet you want to Everything will be alright if we just keep dancing like we're 22 (Whoa, oh) 22 (Dancing like) 22 (Yeah, yeah), 22, (Yeah, yeah, yeah) It feels like one of those nights We ditch the whole scene It feels like one of those nights We won't be sleeping It feels like one of those nights You look like bad news I gotta have you I gotta have you"
179,spotify:track:31pEV5lPJi7btskZoUr2yu,I Almost Do,242573,False,7,Taylor Swift,Red (Deluxe Edition),0.5670000000000001,0.48100000000000004,4,-7.357,0.027000000000000003,0.0173,4.13e-05,0.182,0.233,145.865,63,"I bet this time of night, youre still up I bet youre tired from a long hard week I bet youre sittin' in your chair by the window Looking out at the city, and I bet Sometimes you wonder 'bout me And I just wanna tell you It takes everything in me not to call you And I wish I could run to you And I hope you know that Every time I dont, I almost do, I almost do I bet you think I either moved on or hate you Cause each time you reach out, theres no reply I bet it never, ever occurred to you That I cant say hello to you and risk another goodbye And I just wanna tell you It takes everything in me not to call you And I wish I could run to you And I hope you know that Every time I dont, I almost do, I almost do Oh, we made quite a mess, babe Its probably better off this way And I confess, babe In my dreams, youre touching my face And asking me if I want to try again with you And I almost do And I just wanna tell you It takes everything in me not to call you And I wish I could run to you And I hope you know that Every time I dont, I almost do, I almost do I bet this time of night, youre still up I bet youre tired from a long hard week I bet youre sittin' in your chair by the window Looking out at the city, and I hope Sometimes you wonder 'bout me"
180,spotify:track:1OYARuagDrpgNNQ4loO1Cs,We Are Never Ever Getting Back Together,191880,False,8,Taylor Swift,Red (Deluxe Edition),0.628,0.6759999999999999,7,-5.9110000000000005,0.0916,0.00957,2.65e-05,0.102,0.75,85.984,63,"I remember when we broke up the first time Saying, ""This is it, I've had enough,"" 'cause like We hadn't seen each other in a month When you said you needed space (What?) Then you come around again and say ""Baby, I miss you and I swear I'm gonna change, trust me"" Remember how that lasted for a day? I say, ""I hate you,"" we break up, you call me, I love you Ooh-ooh-ooh-ooh-ooh We called it off again last night, but Ooh-ooh-ooh-ooh-ooh This time, I'm telling you, I'm telling you We are never, ever, ever getting back together We are never, ever, ever getting back together You go talk to your friends, talk to my friends, talk to me But we are never, ever, ever, ever Getting back together Like, ever I'm really gonna miss you picking fights And me falling for it, screaming that I'm right And you would hide away and find your peace of mind With some indie record that's much cooler than mine Ooh-ooh-ooh-ooh-ooh You called me up again tonight, but Ooh-ooh-ooh-ooh-ooh This time, I'm telling you, I'm telling you We (We) are never, ever, ever getting back together We are never, ever, ever getting back together You go talk to your friends, talk to my friends, talk to me (Talk to me) But we are never, ever, ever, ever Getting back together Ooh-ooh-ooh-ooh-ooh (Yeah) Ooh-ooh-ooh-ooh-ooh-ooh (Yeah) Ooh-ooh-ooh-ooh-ooh (Yeah) Oh-oh-oh I used to think that we were forever, ever And I used to say, ""Never say never"" Ugh, so he calls me up and he's like, ""I still love you"" And I'm like, ""I just, I mean, this is exhausting, you know? Like, we are never getting back together, like, ever"" (No) We are never, ever, ever getting back together We are never, ever, ever (Ooh) getting back together You go talk to your friends, talk to my friends, talk to me But we are never, ever, ever, ever Getting back together We (Ooh-ooh-ooh-ooh-ooh, ooh-ooh-ooh, no) Getting back together We (Ooh-ooh-ooh-ooh-ooh, oh, oh) Getting back together (Yeah) You go talk to your friends, talk to my friends, talk to me (Talk to me) But we are never, ever, ever, ever Getting back together"
181,spotify:track:1x0J8LFX23d5h1zzuzZorc,Stay Stay Stay,204826,False,9,Taylor Swift,Red (Deluxe Edition),0.7290000000000001,0.748,0,-6.67,0.0245,0.307,1.29e-06,0.09,0.9279999999999999,99.98100000000001,63,"I'm pretty sure we almost broke up last night I threw my phone across the room, at you I was expecting some dramatic turn away But you stayed This morning, I said we should talk about it 'Cause I read you should never leave a fight unresolved That's when you came in wearing a football helmet And said, ""Okay, let's talk"" And I said Stay, stay, stay I've been loving you for quite some time, time, time You think that it's funny when I'm mad, mad, mad But I think that it's best if we both stay Before you, I'd only dated self-indulgent takers Who took all of their problems out on me But you carry my groceries and now I'm always laughing And I love you because you have given me No choice but to Stay, stay, stay I've been loving you for quite some time, time, time You think that it's funny when I'm mad, mad, mad But I think that it's best if we both stay, stay, stay, stay You took the time to memorize me My fears, my hopes, and dreams I just like hanging out with you, all the time All those times that you didn't leave, it's been occurring to me I'd like to hang out with you, for my whole life Stay, and I'll be loving you for quite some time No one else is gonna love me when I get mad, mad, mad So I think that it's best if we both stay, stay Stay, stay, stay, stay! Stay, stay, stay I've been loving you for quite some time, time, time You think that it's funny when I'm mad, mad, mad But I think that it's best if we both stay, stay Stay, stay, stay, stay! Stay, stay, stay I've been loving you for quite some time, time, time You think that it's funny when I'm mad, mad, mad But I think that it's best if we both stay (Ha-ha-ha, it's so fun)"
182,spotify:track:7vvIpJZye5cRR6De1LKM0m,The Last Time,298293,False,10,Taylor Swift,Red (Deluxe Edition),0.505,0.44299999999999995,2,-7.039,0.0276,0.035,3.15e-06,0.0921,0.12300000000000001,94.069,63,"Find myself at your door Just like all those times before Im not sure how I got there All roads they lead me here I imagine you are home In your room, all alone And you open your eyes into mine And everything feels better And right before your eyes I'm breaking, no past No reasons why Just you and me This is the last time I'm asking you this Put my name at the top of your list This is the last time I'm asking you why You break my heart in the blink of an eye (Eye, eye) You find yourself at my door Just like all those times before You wear your best apology But I was there to watch you leave And all the times I let you in Just for you to go again Disappear when you come back Everything is better And right before your eyes I'm aching, run fast Nowhere to hide Just you and me This is the last time I'm asking you this Put my name at the top of your list This is the last time I'm asking you why You break my heart in the blink of an eye (Eye, eye) This is the last time you tell me I've got it wrong This is the last time I say it's been you all along This is the last time I let you in my door This is the last time, I won't hurt you anymore Oh-ho, oh-ho, oh-ho, oh-ho Oh-ho, oh-ho, oh-ho, oh-ho This is the last time I'm asking you this Put my name at the top of your list This is the last time I'm asking you why You break my heart in the blink of an eye This is the last time I'm asking you this (This is the last time I'm asking you this) Put my name at the top of your list (Put my name at the top of your list) This is the last time I'm asking you why (This is the last time I'm asking you why) You break my heart in the blink of an eye (You break my heart) This is the last time I'm asking you, last time I'm asking you Last time I'm asking you this This is the last time I'm asking you, last time I'm asking you Last time I'm asking you this This is the last time I'm asking you, last time I'm asking you Last time I'm asking you this This is the last time I'm asking you, last time I'm asking you Last time I'm asking you this"
183,spotify:track:5d2Kn9oAAh9S2EbyCo1i52,Holy Ground,201853,False,11,Taylor Swift,Red (Deluxe Edition),0.627,0.816,4,-6.6979999999999995,0.0774,0.0162,0.0020800000000000003,0.0966,0.648,157.043,63,"I was reminiscing just the other day While having coffee all alone, and Lord, it took me away Back to a first-glance feeling on New York time Back when you fit in my poems like a perfect rhyme Took off faster than a green light, go Hey, you skip the conversation when you already know I left a note on the door with a joke we'd made And that was the first day And darling, it was good Never looking down And right there where we stood Was holy ground Spinning like a girl in a brand new dress We had this big wide city all to ourselves We blocked the noise with the sound of, ""I need you"" And for the first time, I had something to lose And I guess we fell apart in the usual way And the story's got dust on every page But sometimes, I wonder how you think about it now And I see your face in every crowd 'Cause darling, it was good Never looking down And right there where we stood Was holy ground Tonight, I'm gonna dance For all that we've been through But I don't wanna dance If I'm not dancing with you Tonight, I'm gonna dance Like you were in this room But I don't wanna dance If I'm not dancing with you It was good Never looking down And right there where we stood Was holy ground Tonight, I'm gonna dance For all that we've been through But I don't wanna dance If I'm not dancing with you Tonight, I'm gonna dance Like you were in this room But I don't wanna dance If I'm not dancing with you"
184,spotify:track:5QKhg4r4Ibt0LVTmWEXTEg,Sad Beautiful Tragic,283680,False,12,Taylor Swift,Red (Deluxe Edition),0.624,0.34,7,-12.411,0.028999999999999998,0.632,0.0337,0.121,0.261,129.987,61,"Long handwritten note, deep in your pocket Words, how little they mean, when you're a little too late I stood right by the tracks, your face in a locket Good girls, hopeful they'll be and long they will wait We had a beautiful magic love affair What a sad, beautiful, tragic love affair In dreams, I meet you in warm conversation We both wake in lonely beds, different cities And time is taking its sweet time erasing you And you've got your demons And darling, they all look like me 'Cause we had a beautiful magic love there What a sad, beautiful, tragic love affair Distance, timing, breakdown, fighting Silence, the train runs off its tracks Kiss me, try to fix it, could you just try to listen? Hang up, give up, and for the life of us we can't get back A beautiful magic love there What a sad, beautiful, tragic, beautiful, tragic, beautiful What we had, a beautiful magic love there What a sad, beautiful, tragic, love affair We had a beautiful magic love there What a sad, beautiful, tragic love affair"
185,spotify:track:2wtHlpYSgC7xEdD3DrSHNL,The Lucky One,240133,False,13,Taylor Swift,Red (Deluxe Edition),0.706,0.499,4,-7.675,0.0369,0.0371,0.0,0.132,0.545,117.93700000000001,62,"New to town with a made up name In the angel's city, chasing fortune and fame And the camera flashes make it look like a dream You had it figured out since you were in school Everybody loves pretty, everybody loves cool So overnight, you look like a sixties queen Another name goes up in lights Like diamonds in the sky And theyll tell you now, youre the lucky one Yeah, theyll tell you now, youre the lucky one But can you tell me now, youre the lucky one? Oh, oh, oh Now, its big black cars and Riviera views And your lover in the foyer doesnt even know you And your secrets end up splashed on the news front page And they tell you that youre lucky, but youre so confused 'Cause you dont feel pretty, you just feel used And all the young things line up to take your place Another name goes up in lights You wonder if youll make it out alive And theyll tell you now, youre the lucky one Yeah, theyll tell you now, youre the lucky one But can you tell me now, youre the lucky one? Oh, oh, oh It was a few years later, I showed up here And they still tell the legend of how you disappeared How you took the money and your dignity, and got the hell out They say you bought a bunch of land somewhere Chose the rose garden over Madison Square And it took some time, but I understand it now Cause now my name is up in lights But I think you got it right Let me tell you now, youre the lucky one Let me tell you now, youre the lucky one Let me tell you now, youre the lucky one, oh, oh, oh And theyll tell you now, youre the lucky one Yeah, theyll tell you now, youre the lucky one And theyll tell you now, youre the lucky one, oh, oh, oh Oh, whoa, oh, oh"
186,spotify:track:7gdwoOmi258QJq0hmQ4hto,Everything Has Changed,243933,False,14,Taylor Swift,Red (Deluxe Edition),0.624,0.45799999999999996,6,-6.755,0.0287,0.36,3.89e-06,0.303,0.436,80.017,62,"(You good to go?) All I knew this morning when I woke Is I know something now Know something now I didn't before And all I've seen since 18 hours ago Is green eyes and freckles and your smile In the back of my mind, making me feel like I just wanna know you better Know you better, know you better now I just wanna know you better Know you better, know you better now I just wanna know you better Know you better, know you better now I just wanna know you, know you, know you 'Cause all I know is we said, ""Hello"" And your eyes look like coming home All I know is a simple name Everything has changed All I know is you held the door You'll be mine and I'll be yours All I know since yesterday Is everything has changed And all my walls stood tall, painted blue And I'll take 'em down, take 'em down And open up the door for you And all I feel in my stomach is butterflies The beautiful kind, making up for lost time Taking flight, making me feel right I just wanna know you better Know you better, know you better now I just wanna know you better Know you better, know you better now I just wanna know you better Know you better, know you better now I just wanna know you, know you, know you 'Cause all I know is we said, ""Hello"" And your eyes look like coming home All I know is a simple name Everything has changed All I know is you held the door You'll be mine and I'll be yours All I know since yesterday Is everything has changed Come back and tell me why I'm feeling like I've missed you all this time And meet me there tonight And let me know that it's not all in my mind I just wanna know you better Know you better, know you better now I just wanna know you, know you, know you 'Cause all I know is we said, ""Hello"" And your eyes look like coming home All I know is a simple name Everything has changed All I know is you held the door You'll be mine and I'll be yours All I know since yesterday Is everything has changed All I know is we said, ""Hello"" So dust off your highest hopes All I know is pouring rain And everything has changed All I know is a new found grace All my days, I'll know your face All I know since yesterday Is everything has changed"
187,spotify:track:0vqI4ZIMuifeKeItGiWbPj,Starlight,217826,False,15,Taylor Swift,Red (Deluxe Edition),0.649,0.777,9,-5.803999999999999,0.0406,0.0213,0.000335,0.221,0.5870000000000001,126.01799999999999,61,"I said, ""Oh, my, what a marvelous tune"" It was the best night, never would forget how we moved The whole place was dressed to the nines And we were dancing, dancing Like we're made of starlight Like we're made of starlight I met Bobby on the boardwalk, summer of '45 Picked me up, late one night at the window We were 17 and crazy, running wild, wild Can't remember what song it was playing when we walked in The night we snuck into a yacht club party Pretending to be a duchess and a prince And I said, ""Oh, my, what a marvelous tune"" It was the best night, never would forget how we moved The whole place was dressed to the nines And we were dancing, dancing Like we're made of starlight, starlight Like we're made of starlight, starlight He said, Look at you, worrying too much about things you can't change You'll spend your whole life singing the blues if you keep thinking that way"" He was trying to skip rocks on the ocean, saying to me ""Don't you see the starlight, starlight? Don't you dream impossible things?"" Like, ""Oh, my, what a marvelous tune"" It was the best night, never would forget how we moved The whole place was dressed to the nines And we were dancing, dancing Like we're made of starlight, starlight Like we're made of starlight, starlight Ooh-ooh, he's talking crazy Ooh-ooh, dancing with me Ooh-ooh, we could get married Have ten kids and teach 'em how to dream Oh, my, what a marvelous tune It was the best night, never would forget how we moved The whole place was dressed to the nines And we were dancing, dancing Like we're made of starlight, starlight Like we're made of starlight, starlight Like we're made of starlight, starlight Like we dream impossible dreams Like starlight, starlight Like we dream impossible dreams Don't you see the starlight, starlight? Don't you dream impossible things?"
188,spotify:track:48A0aShHlovDfTMucMrE66,Begin Again,237613,False,16,Taylor Swift,Red (Deluxe Edition),0.53,0.526,7,-8.349,0.0263,0.19899999999999998,3.52e-06,0.23199999999999998,0.32299999999999995,79.025,62,"Took a deep breath in the mirror He didn't like it when I wore high heels, but I do Turn the lock and put my headphones on He always said he didn't get this song, but I do, I do Walked in, expecting you'd be late But you got here early and you stand and wave I walk to you You pull my chair out and help me in And you don't know how nice that is, but I do And you throw your head back laughing like a little kid I think it's strange that you think I'm funny 'cause he never did I've been spending the last eight months Thinking all love ever does is break and burn and end But on a Wednesday in a caf, I watched it begin again You said you never met one girl who Had as many James Taylor records as you, but I do We tell stories and you don't know why I'm coming off a little shy, but I do But you throw your head back laughing like a little kid I think it's strange that you think I'm funny 'cause he never did I've been spending the last eight months Thinking all love ever does is break and burn and end But on a Wednesday in a caf, I watched it begin again And we walked down the block to my car And I almost brought him up But you start to talk about the movies That your family watches every single Christmas And I want to talk about that And for the first time, what's past is past 'Cause you throw your head back laughing like a little kid I think it's strange that you think I'm funny 'cause he never did I've been spending the last eight months Thinking all love ever does is break and burn and end But on a Wednesday in a caf, I watched it begin again But on a Wednesday in a caf, I watched it begin again"
189,spotify:track:5AsmAjBSSQjRPWgAYIp8tm,The Moment I Knew,285560,False,17,Taylor Swift,Red (Deluxe Edition),0.62,0.506,7,-7.327000000000001,0.0312,0.187,1.47e-05,0.102,0.275,126.015,61,"You should've been there Should've burst through the door With that ""Baby, I'm right here"" smile And it would've felt like A million little shining stars had just aligned And I would've been so happy Christmas lights glisten I've got my eye on the door Just waiting for you to walk in But the time is ticking People ask me how I've been As I comb back through my memory How you said you'd be here You said you'd be here And it was like slow motion Standing there in my party dress In red lipstick With no one to impress And they're all laughing As I'm looking around the room But there was one thing missing And that was the moment I knew And the hours pass by Now I just wanna be alone But your close friends always seem to know When there's something really wrong So they follow me down the hall And there in the bathroom I try not to fall apart And the sinking feeling starts As I say hopelessly ""He said he'd be here"" And it was like slow motion Standing there in my party dress In red lipstick With no one to impress And they're all laughing And asking me about you But there was one thing missing (Missing) And that was the moment I knew What do you say When tears are streaming down your face In front of everyone you know? And what do you do When the one who means the most to you Is the one who didn't show? You should've been here And I would've been so happy And it was like slow motion Standing there in my party dress In red lipstick With no one to impress And they're all standing around me, singing ""Happy birthday to you"" But there was one thing missing And that was the moment I knew Oh-oh-oh-oh-oh-oh-oh, I knew Oh-oh-oh-oh-oh-oh-oh You called me later And said, ""I'm sorry I didn't make it"" And I said, ""I'm sorry, too"" And that was the moment I knew"
